{
  "$schema": "http://json-schema.org/draft-07/schema#",
  "$id": "https://sip-brida/schemas/idp_extraction.schema.json",
  "title": "IDP Extraction - keluaran pipeline 5 tahap untuk satu berkas PDF",
  "description": "Format keluaran scripts/build_dataset_json.py. Satu file = satu PDF. TIDAK ADA nilai null: field yang kosong diisi string kosong dan alasannya dicatat di field_tidak_ada. Nilai yang sudah dipastikan benar disimpan terpisah di blok `verified` supaya output mesin dan label manusia tidak tercampur.",
  "type": "object",
  "required": [
  "document_id",
  "filename",
  "sha256",
  "page_count",
  "is_scanned",
  "doc_type",
  "wilayah",
  "field_relevan",
  "manifest",
  "pipeline",
  "metadata",
  "field_tidak_ada",
  "verified",
  "text_excerpt"
  ],
  "additionalProperties": false,
  "properties": {
    "document_id": {
      "type": ["integer", "string"],
      "description": "ID di tabel documents; string kosong bila belum pernah masuk database"
    },
    "filename": { "type": "string" },
    "sha256": { "type": "string" },
    "file_size_bytes": { "type": "integer" },
    "page_count": { "type": "integer" },
    "is_scanned": {
      "type": "boolean",
      "description": "true = halaman 1 tanpa lapisan teks (kemungkinan scan). Perlu diperiksa manual: dokumen campuran bisa keliru ditandai."
    },
    "doc_type": {
      "type": "object",
      "description": "Jenis dokumen. Menentukan field mana yang WAJAR ada: RKAS tidak punya nomor surat, manual book tidak punya NIP.",
      "required": ["jenis", "label", "keyakinan"],
      "properties": {
        "jenis": {
          "type": "string",
          "enum": ["surat_dinas", "surat_pernyataan", "keputusan", "peraturan", "anggaran",
                   "manual_book", "sop", "laporan", "sertifikat", "berita_acara",
                   "bukti_media", "tidak_diketahui"]
        },
        "label": { "type": "string" },
        "keyakinan": { "type": "number", "minimum": 0, "maximum": 1 }
      }
    },
    "wilayah": {
      "type": "object",
      "description": "Asal daerah dokumen. Ground truth proyek hanya Kota Makassar; yang lain dilaporkan apa adanya.",
      "required": ["kode", "nama"],
      "properties": {
        "kode": {
          "type": "string",
          "enum": ["kota_makassar", "luar_kota_makassar", "tidak_diketahui"]
        },
        "nama": { "type": "string", "description": "Nama entitas terdeteksi, mis. 'KABUPATEN GOWA'" }
      }
    },
    "field_relevan": {
      "type": "array",
      "items": { "type": "string" },
      "description": "Field yang berlaku untuk jenis dokumen ini. Field di luar daftar ini TIDAK dihitung sebagai kesalahan ekstraksi."
    },
    "duplikat_dari": {
      "type": "string",
      "description": "Nama berkas acuan bila isi berkas ini identik (sha256 sama). Berkas ganda tidak dipakai saat evaluasi maupun verifikasi supaya satu dokumen tidak dihitung dua kali."
    },
    "manifest": {
      "type": "object",
      "description": "Kaitan ke indikator. Diisi dari data/reference/evidence_manifest.json; string kosong bila belum dipetakan.",
      "required": ["inovasi_id", "indicator_id", "evidence_tag"],
      "properties": {
        "inovasi_id": { "type": "string" },
        "indicator_id": { "type": "string" },
        "evidence_tag": { "type": "string" }
      }
    },
    "pipeline": {
      "type": "object",
      "required": ["stage1_inspector", "stage2_preprocessing", "stage3_extraction", "stage4_qr", "stage5_validation"],
      "properties": {
        "stage1_inspector": {
          "type": "object",
          "properties": {
            "words_page_1": { "type": "integer" },
            "is_scanned": { "type": "boolean" },
            "text_pages_read": { "type": "integer", "description": "Jumlah halaman yang teksnya dibaca oleh pembangun dataset" }
          }
        },
        "stage2_preprocessing": {
          "type": "object",
          "properties": {
            "target_dpi": { "type": "integer", "default": 300 },
            "pages_rasterized": { "type": "array", "items": { "type": "integer" } },
            "skew_angle_deg": { "type": "number" }
          }
        },
        "stage3_extraction": {
          "type": "object",
          "properties": {
            "engine": { "type": "string", "enum": ["gemini_flash", "smart_heuristics"] },
            "text_source": {
              "type": "string",
              "enum": ["pdf_text_layer", "ocr", ""],
              "description": "Asal teks yang diekstrak. 'ocr' berarti isi dokumen dibaca mesin OCR lokal."
            },
            "ocr_engine": {
              "type": "string",
              "enum": ["rapidocr", "tesseract", ""],
              "description": "Mesin OCR lokal yang dipakai (kosong bila tidak perlu OCR)"
            },
            "field_confidence": { "type": "object" }
          }
        },
        "stage4_qr": {
          "type": "object",
          "properties": {
            "verification_url": { "type": "string", "description": "String kosong bila tidak ada QR verifikasi" },
            "detector": { "type": "string", "enum": ["pyzbar/opencv", "pyzbar", "opencv", ""] }
          }
        },
        "stage5_validation": {
          "type": "object",
          "properties": {
            "is_valid_nip": { "type": "boolean" },
            "confidence_score": { "type": "number", "minimum": 0, "maximum": 1 },
            "needs_manual_review": { "type": "boolean" },
            "validation_flags": { "type": "array", "items": { "type": "string" } }
          }
        }
      }
    },
    "metadata": {
      "type": "object",
      "description": "OUTPUT MESIN. Boleh berisi string kosong. JANGAN diisi manual - nilai yang sudah dipastikan benar ada di blok `verified`.",
      "required": [
        "nomor_surat",
        "instansi",
        "perihal",
        "tanggal_surat",
        "nama_pejabat",
        "jabatan_pejabat",
        "nip_pejabat",
        "verification_url",
        "ada_stempel_basah",
        "ada_tanda_tangan"
      ],
      "properties": {
        "nomor_surat": { "type": "string" },
        "instansi": { "type": "string" },
        "perihal": { "type": "string" },
        "tanggal_surat": { "type": "string", "description": "ISO-8601 YYYY-MM-DD bila berhasil dinormalisasi" },
        "nama_pejabat": { "type": "string" },
        "jabatan_pejabat": { "type": "string" },
        "nip_pejabat": { "type": "string" },
        "verification_url": { "type": "string" },
        "ada_stempel_basah": { "type": "boolean" },
        "ada_tanda_tangan": { "type": "boolean" }
      }
    },
    "field_tidak_ada": {
      "type": "object",
      "description": "Field pada `metadata` yang kosong beserta ALASANNYA. Kunci = nama field, nilai = alasan. Tujuannya supaya 'kosong' tidak ambigu antara pipeline gagal dan dokumen memang tidak memuatnya.",
      "additionalProperties": { "type": "string" }
    },
    "verified": {
      "type": "object",
      "description": "NILAI YANG SUDAH DIPASTIKAN BENAR (label / ground truth). Kosong berarti belum diverifikasi - BUKAN berarti salah.",
      "required": ["status", "sumber", "verified_by", "verified_at", "values", "berbeda_dari_mesin"],
      "properties": {
        "status": {
          "type": "string",
          "enum": ["TERVERIFIKASI", "BELUM_DIVERIFIKASI", "BELUM_TERBACA_SCAN"],
          "description": "TERVERIFIKASI = sudah dibaca ulang manusia; BELUM_TERBACA_SCAN = tidak ada lapisan teks, perlu OCR"
        },
        "sumber": {
          "type": "string",
          "enum": ["anotasi_manual", "pembacaan_ulang", ""],
          "description": "Asal nilai pada `values`"
        },
        "verified_by": { "type": "string" },
        "verified_at": { "type": "string" },
        "values": {
          "type": "object",
          "description": "Nilai benar per field (string kosong bila tidak ada / belum diisi)",
          "properties": {
            "nomor_surat": { "type": "string" },
            "instansi": { "type": "string" },
            "perihal": { "type": "string" },
            "tanggal_surat": { "type": "string" },
            "nama_pejabat": { "type": "string" },
            "jabatan_pejabat": { "type": "string" },
            "nip_pejabat": { "type": "string" },
            "verification_url": { "type": "string" }
          }
        },
        "berbeda_dari_mesin": {
          "type": "array",
          "items": { "type": "string" },
          "description": "Field yang nilainya berbeda dari output mesin. Inilah sinyal error untuk mengukur akurasi ekstraksi per field."
        }
      }
    },
    "text_excerpt": {
    "type": "string",
    "description": "Cuplikan teks mentah untuk inspeksi manual; string kosong bila tidak ada teks"
    },
    "text_sha256": {
    "type": "string",
    "description": "sha256 dari teks dokumen yang sudah dinormalisasi. Dipakai mendeteksi berkas dengan isi sama (dokumen discan/terunduh berulang). Kosong bila dokumen tidak punya teks."
    }
  }
}
