{
  "document_id": "",
  "filename": "kabkota-2026-08-31-kota_makassar-3371a005.pdf",
  "sha256": "7f431eb22d0cca62479f6fb9c82627f869c5047b785ae9e8422f34ae4d1d7855",
  "file_size_bytes": 3225371,
  "page_count": 18,
  "is_scanned": false,
  "doc_type": {
    "jenis": "surat_pernyataan",
    "label": "Surat Pernyataan / Keterangan",
    "keyakinan": 0.8
  },
  "wilayah": {
    "kode": "luar_kota_makassar",
    "nama": "KABUPATEN MAMUJU BADAN PERENCANAAN"
  },
  "field_relevan": [
    "nomor_surat",
    "instansi",
    "perihal",
    "tanggal_surat",
    "nama_pejabat",
    "jabatan_pejabat",
    "nip_pejabat",
    "verification_url"
  ],
  "manifest": {
    "inovasi_id": "",
    "indicator_id": "",
    "evidence_tag": ""
  },
  "pipeline": {
    "stage1_inspector": {
      "words_page_1": 232,
      "is_scanned": false,
      "text_pages_read": 18
    },
    "stage2_preprocessing": {
      "target_dpi": 300,
      "pages_rasterized": [
        1,
        18
      ],
      "skew_angle_deg": 0.0
    },
    "stage3_extraction": {
      "engine": "smart_heuristics",
      "text_source": "pdf_text_layer",
      "ocr_engine": "",
      "field_confidence": {
        "nomor_surat": 0.8,
        "instansi": 0.8,
        "perihal": 0.6,
        "tanggal_surat": 0.8,
        "nip_pejabat": 0.9
      }
    },
    "stage4_qr": {
      "verification_url": "",
      "detector": ""
    },
    "stage5_validation": {
      "is_valid_nip": true,
      "confidence_score": 0.95,
      "needs_manual_review": false,
      "validation_flags": []
    }
  },
  "metadata": {
    "nomor_surat": "500.10.30.3/2/VII/2026",
    "instansi": "PEMERINTAH KABUPATEN MAMUJU BADAN PERENCANAAN PEMBANGUNAN RISET",
    "perihal": "o Makassar (Hadir Menyapa Para Investor Pojok Investasi Kota Makassar) DIGITAL",
    "tanggal_surat": "2026-07-03",
    "nama_pejabat": "Nama : H. BUDIANTO MUIN, S. IP. M. Si",
    "jabatan_pejabat": "Kepala Badan Perencanaan Pembangunan",
    "nip_pejabat": "197112261991011001",
    "verification_url": "",
    "ada_stempel_basah": false,
    "ada_tanda_tangan": false
  },
  "text_excerpt": "PEMERINTAH KABUPATEN MAMUJU\nBADAN PERENCANAAN PEMBANGUNAN RISET\nDAN INOVASI DAERAH\nJalan Soekarno Hatta Telp(0426),         Mamuju 91512\nLaman: www.bapperida.mamujukab.go.id\nSURAT PERNYATAAN\nNomor 500.10.30.3/2/VII/2026\nYang bertanda tangan di bawah ini:\nNama : H. BUDIANTO MUIN, S. IP. M. Si\nNIP : 197112261991011001\nPangkat/Gol. Ruang : Pembina Utama Muda/(IV/c)\nJabatan : Kepala Badan Perencanaan Pembangunan, Riset dan Inovasi\nDaerah\nDengan ini menyatakan bahwa dalam rangka meningkatkan ekosistem dan\nbudaya inovasi daerah di Kabupaten Mamuju Propinsi Sulawesi Barat, maka Pemerintah\nKabupaten Mamuju berminat dan akan melakukan replikasi terhadap inovasi dari\nKotamadya Makassar Propinsi Sulawesi Selatan sebagai berikut :\nNO INSTANSI NAMA INOVASI JENIS\n1\nBagian Hukum & HAM \nSekretariat Daerah Kota \nMakassar\nLOKAL \"LORONG KEADILAN SOSIAL\" \nSistem Aplikasi Informasi \nPenyelenggaraan Bantuan Hukum di Kota \nMakassar\nDIGITAL\n2\nBagian Perencanaan dan\nKeuangan Sekretariat \nDaerah Kota Makassar\nSistem Informasi Tracking Dokumen \nPencairan (Si'ITAKA) DIGITAL\n3\nBagian Organisasi \nSekretariat Daerah Kota \nMakassar\nSIMODEL YANLIK (Sistem Monitoring Dan \nEvaluasi Pelayanan Publik) DIGITAL\n4\nBagian Kerjasama \nSekretariat Daerah Kota \nMakassar\nMACORA 2.0 (Makassar Collaboration Vol \n2) Digitalisasi Pelayanan Fasilitas \nKerjasama Daerah\nDIGITAL\n5 Inspektorat Daerah\nSIPAKATAU (Sistem Informasi Data Tindak\nLanjut) DIGITAL\nAPIP TA\nAplikasi Akkutanang\nDIGITAL\n(Aplikasi Konsultasi dan Pengawasan)\nAP",
  "field_tidak_ada": {
    "verification_url": "tidak ditemukan pada teks dokumen - perlu verifikasi manusia. Catatan: hanya dokumen ber-TTE/QR yang punya URL verifikasi"
  },
  "verified": {
    "status": "BELUM_DIVERIFIKASI",
    "sumber": "",
    "verified_by": "",
    "verified_at": "",
    "values": {
      "nomor_surat": "",
      "instansi": "",
      "perihal": "",
      "tanggal_surat": "",
      "nama_pejabat": "",
      "jabatan_pejabat": "",
      "nip_pejabat": "",
      "verification_url": ""
    },
    "berbeda_dari_mesin": []
  }
}