{
  "document_id": "",
  "filename": "kabkota-2026-08-28-kota_makassar-fb8fdc56.pdf",
  "sha256": "202e948fbdbbeba8ebd8fafec26e56a32c00c4a53660ebb15fe6680fb4cfb045",
  "file_size_bytes": 1289937,
  "page_count": 5,
  "is_scanned": true,
  "doc_type": {
    "jenis": "tidak_diketahui",
    "label": "Belum terklasifikasi",
    "keyakinan": 0.0
  },
  "wilayah": {
    "kode": "tidak_diketahui",
    "nama": ""
  },
  "field_relevan": [],
  "manifest": {
    "inovasi_id": "",
    "indicator_id": "",
    "evidence_tag": ""
  },
  "pipeline": {
    "stage1_inspector": {
      "words_page_1": 0,
      "is_scanned": true,
      "text_pages_read": 5
    },
    "stage2_preprocessing": {
      "target_dpi": 300,
      "pages_rasterized": [
        1,
        5
      ],
      "skew_angle_deg": 0.0
    },
    "stage3_extraction": {
      "engine": "smart_heuristics",
      "text_source": "pdf_text_layer",
      "ocr_engine": "",
      "field_confidence": {
        "nomor_surat": 0.0,
        "instansi": 0.0,
        "perihal": 0.0,
        "tanggal_surat": 0.0,
        "nip_pejabat": 0.0
      }
    },
    "stage4_qr": {
      "verification_url": "",
      "detector": ""
    },
    "stage5_validation": {
      "is_valid_nip": false,
      "confidence_score": 0.05,
      "needs_manual_review": true,
      "validation_flags": [
        "Missing or incomplete Nomor Surat",
        "Missing Instansi",
        "Missing Perihal",
        "Missing or invalid date"
      ]
    }
  },
  "metadata": {
    "nomor_surat": "",
    "instansi": "",
    "perihal": "",
    "tanggal_surat": "",
    "nama_pejabat": "",
    "jabatan_pejabat": "",
    "nip_pejabat": "",
    "verification_url": "",
    "ada_stempel_basah": false,
    "ada_tanda_tangan": false
  },
  "text_excerpt": "0",
  "field_tidak_ada": {
    "nomor_surat": "tidak berlaku untuk jenis dokumen ini (Belum terklasifikasi) - bukan kegagalan ekstraksi",
    "instansi": "tidak berlaku untuk jenis dokumen ini (Belum terklasifikasi) - bukan kegagalan ekstraksi",
    "perihal": "tidak berlaku untuk jenis dokumen ini (Belum terklasifikasi) - bukan kegagalan ekstraksi",
    "tanggal_surat": "tidak berlaku untuk jenis dokumen ini (Belum terklasifikasi) - bukan kegagalan ekstraksi",
    "nama_pejabat": "tidak berlaku untuk jenis dokumen ini (Belum terklasifikasi) - bukan kegagalan ekstraksi",
    "jabatan_pejabat": "tidak berlaku untuk jenis dokumen ini (Belum terklasifikasi) - bukan kegagalan ekstraksi",
    "nip_pejabat": "tidak berlaku untuk jenis dokumen ini (Belum terklasifikasi) - bukan kegagalan ekstraksi",
    "verification_url": "tidak berlaku untuk jenis dokumen ini (Belum terklasifikasi) - bukan kegagalan ekstraksi"
  },
  "verified": {
    "status": "BELUM_TERBACA_SCAN",
    "sumber": "",
    "verified_by": "",
    "verified_at": "",
    "values": {
      "nomor_surat": "",
      "instansi": "",
      "perihal": "",
      "tanggal_surat": "",
      "nama_pejabat": "",
      "jabatan_pejabat": "",
      "nip_pejabat": "",
      "verification_url": ""
    },
    "berbeda_dari_mesin": []
  }
}