{
  "document_id": "",
  "filename": "kabkota-2026-08-28-kota_makassar-55f83d38.pdf",
  "sha256": "1e34575622aa2d3613fa6e1acd52e83b1e768d15364caadee148607b9791d852",
  "file_size_bytes": 95767,
  "page_count": 6,
  "is_scanned": false,
  "doc_type": {
    "jenis": "keputusan",
    "label": "Keputusan (SK/SKB)",
    "keyakinan": 1.0
  },
  "wilayah": {
    "kode": "kota_makassar",
    "nama": "KOTA MAKASSAR"
  },
  "field_relevan": [
    "nomor_surat",
    "instansi",
    "perihal",
    "tanggal_surat",
    "nama_pejabat",
    "jabatan_pejabat",
    "nip_pejabat",
    "verification_url"
  ],
  "manifest": {
    "inovasi_id": "",
    "indicator_id": "",
    "evidence_tag": ""
  },
  "pipeline": {
    "stage1_inspector": {
      "words_page_1": 318,
      "is_scanned": false,
      "text_pages_read": 6
    },
    "stage2_preprocessing": {
      "target_dpi": 300,
      "pages_rasterized": [
        1,
        6
      ],
      "skew_angle_deg": 0.0
    },
    "stage3_extraction": {
      "engine": "smart_heuristics",
      "text_source": "pdf_text_layer",
      "ocr_engine": "",
      "field_confidence": {
        "nomor_surat": 0.8,
        "instansi": 0.8,
        "perihal": 0.6,
        "tanggal_surat": 0.8,
        "nip_pejabat": 0.9
      }
    },
    "stage4_qr": {
      "verification_url": "https://srikandi.arsip.go.id/result-scan/gi5KG7AJO6UTqKPMaOHINw",
      "detector": "pyzbar/opencv"
    },
    "stage5_validation": {
      "is_valid_nip": true,
      "confidence_score": 1.0,
      "needs_manual_review": false,
      "validation_flags": []
    }
  },
  "metadata": {
    "nomor_surat": "400.3.10/2/S.Kep/Disdik/VIII/2026",
    "instansi": "KOTA MAKASSAR KEPUTUSAN KEPALA DINAS PENDIDIKAN KOTA MAKASSAR",
    "perihal": "Pembentukan Tim Inovasi Lingkup TK SD dan SMP se-Kota Makassar Tahun 2026.",
    "tanggal_surat": "2026-08-05",
    "nama_pejabat": "",
    "jabatan_pejabat": "KEPALA DINAS PENDIDIKAN KOTA MAKASSAR",
    "nip_pejabat": "197708311995112001",
    "verification_url": "https://srikandi.arsip.go.id/result-scan/gi5KG7AJO6UTqKPMaOHINw",
    "ada_stempel_basah": false,
    "ada_tanda_tangan": false
  },
  "text_excerpt": "${ttd_pengirim} \nr4$_0{nn0ao.s3mk.a1oh0r}_naskah} ${nomo \n \nKOTA MAKASSAR \nKEPUTUSAN KEPALA DINAS PENDIDIKAN KOTA MAKASSAR \nNomor : 400.3.10/2/S.Kep/Disdik/VIII/2026 \nTENTANG \nPembentukan Tim Inovasi \nLingkup TK SD dan SMP se-Kota Makassar Tahun 2026. \nMenimbang : \n \n \n \n \n \n \nMengingat : \n1. Bahwa dalam rangka mendukung pelaksanaan inovasi daerah di lingkup TK  \nSD dan SMP se -Kota Makassar, diperlukan pembentukan Tim Inovasi yang \ndapat mengelola, melaksanakan, dan melaporkan kegiatan inovasi secara \nterstruktur. \n2. Bahwa untuk menjamin keberlangsungan, akuntabilitas, dan keberlanjutan \ninovasi daerah, perlu ditetapkan Surat Keputusan Kepala Dinas Pendidikan atas \nnama Wali Kota Makassar  tentang Tim Inovasi Bersama Lingkup TK SD dan \nSMP se-Kota Makassar Tahun 2026. \n1. Undang-Undang Nomor 23 Tahun 2014 tentang Pemerintahan Daerah \n2. Undang-Undang Nomor 20 Tahun 2023 tentang Sistem Pendidikan Nasional \n3. Peraturan Pemerintah RI Nomor 38 Tahun 2017 tentang Inovasi Daerah \n4. Peraturan Menteri Dalam Negeri RI Nomor 104 Tahun 2018 tentang Penilaian \ndan Pemberian Penghargaan dan/atau Insentif Inovasi Daerah \n5. Peraturan Daerah Kota Makassar Nomor 9 Tahun 2023 tentang Inovasi Daerah \nMEMUTUSKAN \nMenetapkan : PEMBENTUKAN TIM INOVASI LINGKUP TK SD DAN SMP \nSE-KOTA MAKASSAR TAHUN 2026. \n \nPertama : \n \n \nKedua : \n \n \n \nKetiga : \n \n \n \nKeempat : \n \n \nKelima : \n \nKeenam : \nPembentukan Tim Inovasi (per satuan inovasi) sebagaimana tercantum dalam \nLampiran SK ini. \nTim Inovasi seb",
  "field_tidak_ada": {
    "nama_pejabat": "tidak ditemukan pada teks dokumen - perlu verifikasi manusia. Catatan: dokumen tanpa blok tanda tangan (lampiran, tangkapan layar) tidak memuat nama"
  },
  "verified": {
    "status": "BELUM_DIVERIFIKASI",
    "sumber": "",
    "verified_by": "",
    "verified_at": "",
    "values": {
      "nomor_surat": "",
      "instansi": "",
      "perihal": "",
      "tanggal_surat": "",
      "nama_pejabat": "",
      "jabatan_pejabat": "",
      "nip_pejabat": "",
      "verification_url": ""
    },
    "berbeda_dari_mesin": []
  },
  "text_sha256": "2df5c886a1de2564ebc3584613fce0cb01dd25f46e427e63367b2a9157342083",
  "duplikat_dari": "kabkota-2026-08-28-kota_makassar-3cade67d.pdf"
}