{
  "document_id": "",
  "filename": "kabkota-2026-08-28-kota_makassar-103081cb.pdf",
  "sha256": "3bf46f3a29ab08548489eb2c306be4b654f222ec844643d7bcb23a5870264578",
  "file_size_bytes": 3660543,
  "page_count": 20,
  "is_scanned": true,
  "doc_type": {
    "jenis": "peraturan",
    "label": "Peraturan (Perwali/Perda/Perbup)",
    "keyakinan": 1.0
  },
  "wilayah": {
    "kode": "kota_makassar",
    "nama": "KOTA MAKASSAR UNTUK PERIODE"
  },
  "field_relevan": [
    "nomor_surat",
    "instansi",
    "perihal",
    "tanggal_surat",
    "verification_url"
  ],
  "manifest": {
    "inovasi_id": "",
    "indicator_id": "",
    "evidence_tag": ""
  },
  "pipeline": {
    "stage1_inspector": {
      "words_page_1": 0,
      "is_scanned": true,
      "text_pages_read": 20
    },
    "stage2_preprocessing": {
      "target_dpi": 300,
      "pages_rasterized": [
        1,
        20
      ],
      "skew_angle_deg": 0.0
    },
    "stage3_extraction": {
      "engine": "smart_heuristics",
      "text_source": "pdf_text_layer",
      "ocr_engine": "",
      "field_confidence": {
        "nomor_surat": 0.0,
        "instansi": 0.8,
        "perihal": 0.6,
        "tanggal_surat": 0.0,
        "nip_pejabat": 0.0
      }
    },
    "stage4_qr": {
      "verification_url": "",
      "detector": ""
    },
    "stage5_validation": {
      "is_valid_nip": false,
      "confidence_score": 0.35,
      "needs_manual_review": true,
      "validation_flags": [
        "Missing or incomplete Nomor Surat",
        "Missing or invalid date"
      ]
    }
  },
  "metadata": {
    "nomor_surat": "",
    "instansi": "WALi KOTA MAKASSAR PERA TU RAN W ALI KOTA MAKASSAR",
    "perihal": "RENCANA KERJA PEMERINTAH DAERAH TAHUN 2026 DENGAN RAHMAT TUHAN YANG MAHA ESA",
    "tanggal_surat": "",
    "nama_pejabat": "",
    "jabatan_pejabat": "kepala daerah dan DPRD dalam penyelenggaraan Urusan",
    "nip_pejabat": "",
    "verification_url": "",
    "ada_stempel_basah": false,
    "ada_tanda_tangan": false
  },
  "text_excerpt": "-------------------------------------------� \nWALi KOTA MAKASSAR \nPROVINS! SULAWESI SELATAN \nPERA TU RAN W ALI KOTA MAKASSAR \nNOMOR 1S TAHUN 2025 \nTENTANG \nRENCANA KERJA PEMERINTAH DAERAH TAHUN 2026 \nDENGAN RAHMAT TUHAN YANG MAHA ESA \nWALi KOTA MAKASSAR, \nMenirnbang \nMengingat \nbahwa untuk rnelaksanakan ketentuan Pasal 26 ayat (2) \nUndang-Undang Norn.or 25 Tahun 2004 tentang Sistem \nPerencanaan Pembangunan Nasional dan ketentuan Pasal \n264 ayat (2) Undang-Undang 23 Tahun 2014 tentang \nPernerintahan Daerah sebagairnana telah diubah beberapa \nkali terakhir dengan Undang-Undang 6 Tahun 2023 \ntentang Penetapan Peraturan Pemerintah Pengganti \nr _.-. TT _. 1 .- r .--=.%. t nr _ 1 .-.- tot t-.- 4-.- - 4' ..4or.' UIudIUIIUAll INOIIIUI A IAuun 4u44 uci~ii pa hcijd \nmenjadi Undang-Undang, perlu menetapkan Peraturan \nWali Kota tentang Rencana Kerja Pemerintah Daerah \nTahun 2026; \n1. Pasal 18 ayat (6) Undang-Undang Dasar Negara \nRepublik Indonesia Tahun 1945; \n2. Undang-Undang Nomor 25 Tahun 2004 tentang \nSistern Perencanaan Pembangunan Nasional \n(Lembaran Negara Republik Indonesia Tahun 2004 \nNomor 104, Tambahan Lembaran Negara Republik \nIndonesia Nomor 4421) ; \n3. Undang-Undang Nomor 23 Tahun 2014 tentang \nPemerintahan Daerah (1Lembaran Negara Republik \nIndonesia Tahun 2014 Nomor 244, Tambahan \nLembaran Negara Republik Indonesia Nomor 5587) \nsebagaimana telah diubah beberapa ali terakhir \ndengan Undang-Undang Nomor 6 Tahun 2023 tentang \nPenetapan Peraturan Pemerintah Pengganti Undang­ ",
  "field_tidak_ada": {
    "nomor_surat": "dokumen hasil scan tanpa lapisan teks - belum ada OCR. Catatan: surat pernyataan, berita acara, lampiran, dan sertifikat sering tanpa nomor",
    "tanggal_surat": "dokumen hasil scan tanpa lapisan teks - belum ada OCR. Catatan: tanggal tidak selalu tercetak (mis. lampiran, rekapitulasi)",
    "nama_pejabat": "tidak berlaku untuk jenis dokumen ini (Peraturan (Perwali/Perda/Perbup)) - bukan kegagalan ekstraksi",
    "nip_pejabat": "tidak berlaku untuk jenis dokumen ini (Peraturan (Perwali/Perda/Perbup)) - bukan kegagalan ekstraksi",
    "verification_url": "dokumen hasil scan tanpa lapisan teks - belum ada OCR. Catatan: hanya dokumen ber-TTE/QR yang punya URL verifikasi"
  },
  "verified": {
    "status": "BELUM_TERBACA_SCAN",
    "sumber": "",
    "verified_by": "",
    "verified_at": "",
    "values": {
      "nomor_surat": "",
      "instansi": "",
      "perihal": "",
      "tanggal_surat": "",
      "nama_pejabat": "",
      "jabatan_pejabat": "",
      "nip_pejabat": "",
      "verification_url": ""
    },
    "berbeda_dari_mesin": []
  }
}